{
  "slug": "lonely-dezires",
  "name": "LONELY DEZIRES",
  "nameEn": "Lonely Dezires",
  "category": "other",
  "description": null,
  "sources": [
    {
      "url": "https://www.ddtpro.jp/wrestlers/67bd66759342b300022f3668",
      "title": "KANON | DDT プロレスリング公式サイト",
      "retrievedAt": "2026-08-20"
    }
  ]
}
