{
  "slug": "cannonball-450",
  "name": "キャノンボール450°",
  "nameEn": "Cannonball 450",
  "category": "aerial",
  "description": null,
  "sources": [
    {
      "url": "https://www.ddtpro.jp/wrestlers/67bd666e9342b300022f364f",
      "title": "MAO | DDT プロレスリング公式サイト",
      "retrievedAt": "2026-08-20"
    }
  ]
}
