{
  "slug": "danshoku-driver",
  "name": "男色ドライバー",
  "nameEn": "Danshoku Driver",
  "category": "throw",
  "description": null,
  "sources": [
    {
      "url": "https://www.ddtpro.jp/wrestlers/67bd666f9342b300022f3654",
      "title": "男色ディーノ | DDT プロレスリング公式サイト",
      "retrievedAt": "2026-08-20"
    }
  ]
}
