{
  "slug": "praying-mantis-bomb",
  "name": "プレイングマンティスボム",
  "nameEn": "Praying Mantis Bomb",
  "category": "throw",
  "description": null,
  "sources": [
    {
      "url": "https://www.ddtpro.jp/wrestlers/67bd666a9342b300022f3645",
      "title": "クリス・ブルックス | DDT プロレスリング公式サイト",
      "retrievedAt": "2026-08-20"
    }
  ]
}
