{
  "slug": "totonoe-splash",
  "name": "ととのえスプラッシュ",
  "nameEn": "Totonoe Splash",
  "category": "aerial",
  "description": null,
  "sources": [
    {
      "url": "https://www.ddtpro.jp/wrestlers/67bd66929342b300022f36d3",
      "title": "勝俣瞬馬 | DDT プロレスリング公式サイト",
      "retrievedAt": "2026-08-20"
    }
  ]
}
