{
  "slug": "front-necklock",
  "name": "フロントネックロック",
  "nameEn": "Front Necklock",
  "category": "submission",
  "description": null,
  "sources": [
    {
      "url": "https://www.njpw.co.jp/card-result/666514",
      "title": "新日カードランブル presents G1 CLIMAX 36 | 新日本プロレスリング株式会社",
      "retrievedAt": "2026-08-20"
    }
  ]
}
