{
  "slug": "stone-cold-stunner",
  "name": "ストーンコールド・スタナー",
  "nameEn": "Stone Cold Stunner",
  "category": "strike",
  "description": null,
  "sources": [
    {
      "url": "https://www.ddtpro.jp/results/6a7b05a1a862f20002deed36",
      "title": "WRESTLE PETER PAN 2026 | DDT プロレスリング公式サイト",
      "retrievedAt": "2026-08-20"
    }
  ]
}
