{
  "slug": "kojima-impact",
  "name": "コジマインパクト",
  "nameEn": "Kojima Impact",
  "category": "other",
  "description": null,
  "sources": [
    {
      "url": "https://www.ddtpro.jp/wrestlers/67bd667e9342b300022f368b",
      "title": "To-y | DDT プロレスリング公式サイト",
      "retrievedAt": "2026-08-20"
    }
  ]
}
